,conversation_id,conversation_history,translation
0,5001-da37bcbf-83a8-46ba-9e29-e1ffb252af33,"Tutor: Hi, could you please provide a step-by-step solution for the question below? The question is: The length of the straight part of a river is three times shorter than the crooked part. If the river is 80 miles long, how long is the straight part of the river? 
 Student: Let x be the length of the crooked part of the river.
Then, the length of the straight part of the river is 3x.
And we know that the total length of the river is 80 miles.
So, we have the equation x + 3x = 80.
Simplifying the equation, we get 4x = 80.
Solving for x, we get x = 20.
Therefore, the length of the straight part of the river is 3x = 3(20) = 60 miles.
 60 
 Tutor: guide me through your thinking please? 
 Student: I started by letting x be the length of the crooked part of the river. Then I used the given information that the length of the straight part of the river is three times shorter than the crooked part, so I set up the equation x + 3x = 80. I then simplified the equation to 4x = 80 and solved for x to get x = 20. Finally, I used the value of x to calculate the length of the straight part of the river, which is 3x = 3(20) = 60 miles. 
 Tutor: ok if you read the question again how long is the crooked part of the river? 
 Student: The length of the crooked part of the river is x = 20 miles.","Tutor: Hola, ¿podría proporcionar una solución paso a paso para la pregunta a continuación? La pregunta es: la longitud de la parte recta de un río es tres veces más corta que la parte torcida. Si el río tiene 80 millas de largo, ¿cuánto tiempo es la parte recta del río? 
 Estudiante: Sea X la longitud de la parte torcida del río.
Luego, la longitud de la parte recta del río es 3x.
Y sabemos que la longitud total del río es de 80 millas.
Entonces, tenemos la ecuación x + 3x = 80.
Simplificando la ecuación, obtenemos 4x = 80.
Resolviendo para x, obtenemos x = 20.
Por lo tanto, la longitud de la parte recta del río es 3x = 3 (20) = 60 millas.
 60 
 Tutor: ¿Guíame a través de su pensamiento por favor? 
 Estudiante: Comencé dejando que X sea la longitud de la parte torcida del río. Luego utilicé la información dada de que la longitud de la parte recta del río es tres veces más corta que la parte torcida, por lo que configuré la ecuación x + 3x = 80. Luego simplifiqué la ecuación a 4x = 80 y resuelto para obtener x = 20. Finalmente, usé el valor de x para calcular la longitud de la parte recta del río, que es 3x = 3 (20) = 60 millas. 
 Tutor: OK, si lees la pregunta nuevamente, ¿cuánto tiempo es la parte torcida del río? 
 Estudiante: La longitud de la parte torcida del río es x = 20 millas."
1,3531-50ba510d-34e7-401f-bbd5-2397aca918a2,"Tutor: Hi, could you please provide a step-by-step solution for the question below? The question is: Four classmates were comparing their ages based on their birth month. They found out that Jolyn is 2 months older than Therese while Therese is 5 months older than Aivo. Then, Leon is 2 months older than Aivo. How much older in months is Jolyn than Leon? 
 Student: We can start by creating a diagram to visualize the relationships between the classmates' ages:

Aivo --(5 months)--> Therese --(2 months)--> Jolyn
|
(2 months)
|
Leon

From the diagram, we can see that Jolyn is 2 + 5 = 7 months older than Aivo, and Leon is 2 months older than Aivo. Therefore, Jolyn is 7 + 2 = 9 months older than Leon.
 9 
 Tutor: Can you talk me through your solution? 
 Student: Sure. I started by creating a diagram to visualize the relationships between the classmates' ages. Aivo is 5 months older than Therese and Therese is 2 months older than Jolyn. Leon is 2 months older than Aivo. So Jolyn is 7 months older than Aivo and 2 months older than Leon which means she is 9 months older than Leon. 
 Tutor: A diagram to visualise the problem is a great idea. And you have made a good start but you have made an error in one of the steps. Can you look over it again and see if you can spot where it is? 
 Student: Sure. I started by creating a diagram to visualize the relationships between the classmates' ages. Aivo is 5 months older than Therese and Therese is 2 months older than Jolyn. Leon is 2 months older than Aivo. So Jolyn is 7 months older than Aivo and 2 months older than Leon which means she is 9 months older than Leon. Oh I see my mistake. Jolyn is 7 months older than Aivo and 5 months older than Leon which means she is 12 months older than Leon.","Tutor: Hola, ¿podría proporcionar una solución paso a paso para la pregunta a continuación? La pregunta es: cuatro compañeros de clase comparaban sus edades en función de su mes de nacimiento. Descubrieron que Jolyn es 2 meses mayor que Therese, mientras que Therese es 5 meses mayor que Aivo. Entonces, Leon es 2 meses mayor que Aivo. ¿Cuánto mayor en meses es Jolyn que Leon? 
 Estudiante: podemos comenzar creando un diagrama para visualizar las relaciones entre las edades de los compañeros de clase:

Aivo-(5 meses)-> Therese-(2 meses)-> Jolyn
|
(2 meses)
|
León

Desde el diagrama, podemos ver que Jolyn es 2 + 5 = 7 meses mayor que aivo, y Leon es 2 meses mayor que aivo. Por lo tanto, Jolyn es 7 + 2 = 9 meses mayor que Leon.
 9 
 Tutor: ¿Puedes hablarme sobre tu solución? 
 Estudiante: Claro. Comencé creando un diagrama para visualizar las relaciones entre las edades de los compañeros de clase. Aivo es 5 meses mayor que Therese y Therese es 2 meses mayor que Jolyn. Leon es 2 meses mayor que Aivo. Entonces, Jolyn es 7 meses mayor que Aivo y 2 meses mayor que Leon, lo que significa que es 9 meses mayor que Leon. 
 Tutor: un diagrama para visualizar el problema es una gran idea. Y ha hecho un buen comienzo, pero ha cometido un error en uno de los pasos. ¿Puedes revisarlo nuevamente y ver si puedes detectar dónde está? 
 Estudiante: Claro. Comencé creando un diagrama para visualizar las relaciones entre las edades de los compañeros de clase. Aivo es 5 meses mayor que Therese y Therese es 2 meses mayor que Jolyn. Leon es 2 meses mayor que Aivo. Entonces, Jolyn es 7 meses mayor que Aivo y 2 meses mayor que Leon, lo que significa que es 9 meses mayor que Leon. Oh, veo mi error. Jolyn es 7 meses mayor que Aivo y 5 meses mayor que Leon, lo que significa que es 12 meses mayor que Leon."
2,4500-9466d5b5-41fc-48f4-b665-cea0ec0341af,"Tutor: Hi, could you please provide a step-by-step solution for the question below? The question is: Carla is taking attendance for her sixth-grade class. She knows that 2 Students are in the restroom, and one less than three times that number of Students are absent. If there are four rows with six desks each that are all 2/3 full, how many Students does Carla teach, including the ones in and out of the classroom? 
 Student: Number of Students in the restroom = 2
Number of absent Students = 3(2) - 1 = 5
Number of Students present = Total number of Students - (number of Students in restroom + number of absent Students)
Number of Students present in each row = 6 x 2/3 = 4
Total number of Students in all rows = 4 x 4 = 16
Total number of Students Carla teaches = number of Students present + number of Students in the restroom = 16 + 2 = 18
 18 
 Tutor: Hello Jordy, can you talk me through your summary 
 Student: Sure, I said that the number of Students in the restroom is 2 and the number of absent Students is 3(2) - 1 = 5. Then I calculated that the number of Students present in each row is 6 x 2/3 = 4, and the total number of Students in all rows is 4 x 4 = 16. Finally, I added the number of Students present and the number of Students in the restroom to get the total number of Students Carla teaches, which is 16 + 2 = 18","Tutor: Hola, ¿podría proporcionar una solución paso a paso para la pregunta a continuación? La pregunta es: Carla está asistiendo a su clase de sexto grado. Ella sabe que 2 estudiantes están en el baño, y una menos de tres veces que el número de estudiantes está ausente. Si hay cuatro filas con seis escritorios cada una que están llenas 2/3, ¿cuántos estudiantes enseña Carla, incluidos las que entran y salen del aula? 
 Estudiante: Número de estudiantes en el baño = 2
Número de estudiantes ausentes = 3 (2) - 1 = 5
Número de estudiantes presentes = Número total de estudiantes - (Número de estudiantes en el baño + número de estudiantes ausentes)
Número de estudiantes presentes en cada fila = 6 x 2/3 = 4
Número total de estudiantes en todas las filas = 4 x 4 = 16
Número total de estudiantes que Carla enseña = número de estudiantes presentes + número de estudiantes en el baño = 16 + 2 = 18
 18 
 Tutor: Hola Jordy, ¿puedes hablarme sobre tu resumen? 
 Estudiante: Claro, dije que el número de estudiantes en el baño es 2 y el número de estudiantes ausentes es 3 (2) - 1 = 5. Luego calculé que el número de estudiantes presentes en cada fila es 6 x 2/3 = 4, y el número total de estudiantes en todas las filas es 4 x 4 = 16. Finalmente, agregué el número de estudiantes presentes y el número de estudiantes en el baño para obtener el número total de estudiantes de Carla, que es 16 + 2."
3,1362-57847e76-3d61-4b0c-a413-cf3a23baa811,"Tutor: Hi, could you please provide a step-by-step solution for the question below? The question is: Solo has to read 4 pages from his Science textbook, 20 pages from his Social Studies textbook, 7 pages from his History textbook and 8 pages from his Geography textbook. Solo read 15 pages on Monday. If he has 4  more days to complete all his reading, how many pages does he need to read, on average, in one day? 
 Student: Solo needs to read a total of 4+20+7+8 = 39 pages.
He has 4 more days to complete his reading, so he has a total of 4+1 = 5 days to finish all his reading.
He already read 15 pages on Monday, so he needs to read 39-15 = 24 more pages.
On average, he needs to read 24/5 = 4.8 pages per day (rounded to one decimal place).
 4.8 
 Tutor: Explain your solution 
 Student: To solve this problem, I first calculated the total number of pages Solo needs to read, which is 4+20+7+8 = 39 pages. Then I subtracted the number of pages Solo already read on Monday, which was 15 pages. This left me with 24 pages that needed to be read in the remaining 4 days. To find the average number of pages per day, I divided the 24 pages by the 4 days, which gave me 4.8 pages per day. 
 Tutor: How many pages to read 
 Student: Solo needs to read a total of 39 pages. He has already read 15 pages on Monday, so he needs to read 24 more pages. On average, he needs to read 4.8 pages per day. 
 Tutor: He read 15 on Monday so how many pages after that 
 Student: After reading 15 pages on Monday, Solo needs to read a total of 24 more pages in the remaining 4 days. This means he needs to read an average of 4.8 pages per day.","Tutor: Hola, ¿podría proporcionar una solución paso a paso para la pregunta a continuación? La pregunta es: Solo tiene que leer 4 páginas de su libro de texto de ciencias, 20 páginas de su libro de texto de estudios sociales, 7 páginas de su libro de texto de historia y 8 páginas de su libro de texto de geografía. Solo leyó 15 páginas el lunes. Si tiene 4 días más para completar toda su lectura, ¿cuántas páginas necesita leer, en promedio, en un día? 
 Estudiante: Solo necesita leer un total de 4+20+7+8 = 39 páginas.
Tiene 4 días más para completar su lectura, por lo que tiene un total de 4+1 = 5 días para terminar toda su lectura.
Ya leyó 15 páginas el lunes, por lo que necesita leer 39-15 = 24 páginas más.
En promedio, necesita leer 24/5 = 4.8 páginas por día (redondeadas a un lugar decimal).
 4.8 
 Tutor: explique su solución 
 Estudiante: para resolver este problema, primero calculé el número total de páginas que solo necesita leer, que es 4+20+7+8 = 39 páginas. Luego resté el número de páginas en solitario que ya leí el lunes, que eran de 15 páginas. Esto me dejó con 24 páginas que debían leer en los 4 días restantes. Para encontrar el número promedio de páginas por día, dividí las 24 páginas en los 4 días, lo que me dio 4.8 páginas por día. 
 Tutor: cuántas páginas leer 
 Estudiante: Solo necesita leer un total de 39 páginas. Ya ha leído 15 páginas el lunes, por lo que necesita leer 24 páginas más. En promedio, necesita leer 4.8 páginas por día. 
 Tutor: Leyó 15 el lunes, entonces cuántas páginas después de eso 
 Estudiante: Después de leer 15 páginas el lunes, Solo necesita leer un total de 24 páginas más en los 4 días restantes. Esto significa que necesita leer un promedio de 4.8 páginas por día."
4,2172-795767b0-5b4f-4917-a743-8eab61b591d0,"Tutor: Hi, could you please provide a step-by-step solution for the question below? The question is: Sid takes $48 with him on a shopping trip to the mall.  He spent some of his money on computer accessories and another $8 on snacks. After these purchases, he only has $4 more than half of his original money left. How much did he spend on computer accessories? 
 Student: Let's call the amount Sid spent on computer accessories ""x"".
After buying computer accessories and snacks, Sid has 48 - x - 8 = 40 - x dollars left.
We know that this is $4 more than half of his original money, which was 48/2 = 24 dollars.
So we can set up an equation: 40 - x = 24 + 4.
Simplifying and solving for x, we get x = 20.
Therefore, Sid spent $20 on computer accessories.
 20 
 Tutor: Hello Heidi can you talk me through your thinking?  
 Student: Sure. I started by setting up an equation to represent the problem. I knew that Sid had $48 to start with, so I subtracted the amount he spent on computer accessories and snacks from that to get the amount he had left. I then set up the equation 40 - x = 24 + 4, since that was the amount he had left and half of his original money plus $4. After simplifying the equation, I solved for x and got x = 20, which meant that Sid spent $20 on computer accessories. 
 Tutor: How much is half of his original money? 
 Student: Half of his original money is 48/2 = 24 dollars. 
 Tutor: So how much did he have left after his purchases? 
 Student: After his purchases, he had 48 - x - 8 = 40 - x dollars left.","Tutor: Hola, ¿podría proporcionar una solución paso a paso para la pregunta a continuación? La pregunta es: Sid toma $ 48 con él en un viaje de compras al centro comercial.  Gastó parte de su dinero en accesorios de computadora y otros $ 8 en bocadillos. Después de estas compras, solo le queda $ 4 más de la mitad de su dinero original. ¿Cuánto gastó en accesorios de computadora? 
 Estudiante: Llamemos a la cantidad que SID gastó en accesorios de computadora ""X"".
Después de comprar accesorios y bocadillos de la computadora, Sid tiene 48 - x - 8 = 40 - x dólares restantes.
Sabemos que se trata de $ 4 más de la mitad de su dinero original, que era 48/2 = 24 dólares.
Entonces podemos configurar una ecuación: 40 - x = 24 + 4.
Simplificando y resolviendo para x, obtenemos x = 20.
Por lo tanto, Sid gastó $ 20 en accesorios de computadora.
 20 
 Tutor: Hola Heidi, ¿puedes hablarme sobre tu pensamiento?  
 Estudiante: Claro. Comencé configurando una ecuación para representar el problema. Sabía que Sid tenía $ 48 para comenzar, así que resté la cantidad que gastó en accesorios y bocadillos de la computadora de eso para obtener la cantidad que le quedaba. Luego configuré la ecuación 40 - x = 24 + 4, ya que esa era la cantidad que le quedaba y la mitad de su dinero original más $ 4. Después de simplificar la ecuación, resolví para x y obtuve x = 20, lo que significaba que Sid gastó $ 20 en accesorios de computadora. 
 Tutor: ¿Cuánto cuesta la mitad de su dinero original? 
 Estudiante: la mitad de su dinero original es 48/2 = 24 dólares. 
 Tutor: Entonces, ¿cuánto le quedó después de sus compras? 
 Estudiante: Después de sus compras, tenía 48 - x - 8 = 40 - x dólares restantes."
5,2672-c8c14096-d003-49fc-8aae-371660962a45,"Tutor: Hi, could you please provide a step-by-step solution for the question below? The question is: You can lower the price by 20% if you buy more than fifteen units of iPhone cases. If you pay $500 to buy 18 units, what is the original price? 
 Student: First, let's find the price per unit after the 20% discount:
If the original price is x, then the discounted price is 0.8x (since 20% off is the same as multiplying by 0.8). We know that this discounted price is what we paid for 18 units, so:

18(0.8x) = 500

Simplifying this equation:

14.4x = 500

x = 34.72 (rounded to two decimal places)

Therefore, the original price per unit was $34.72.
 34.72 
 Tutor: can you talk me through your solution? 
 Tutor: Hi Student can you talk me through your solution? 
 Student: Sure! I started by finding the price per unit after the 20% discount. I knew that the original price was x so I multiplied it by 0.8 to get the discounted price. Then I knew that this discounted price was what we paid for 18 units so I set up an equation with 18 multiplied by 0.8x equal to 500. After simplifying the equation I got x = 34.72 which is the original price per unit. 
 Tutor: Ok let's start with the first step. How much is 80% of the total cost? 
 Student: 80% of the total cost is 0.8x. So if the original price is x then the discounted price is 0.8x. 
 Tutor: let's focus on the overall amount rather than the unit amount 
 Student: Sure. We know that the total amount paid for 18 units was $500. So I set up an equation with 18 multiplied by 0.8x equal to 500. After simplifying the equation I got x = 34.72 which is the original price for the total amount.","Tutor: Hola, ¿podría proporcionar una solución paso a paso para la pregunta a continuación? La pregunta es: puede reducir el precio en un 20% si compra más de quince unidades de fundas para iPhone. Si paga $ 500 para comprar 18 unidades, ¿cuál es el precio original? 
 Estudiante: Primero, encontremos el precio por unidad después del 20% de descuento:
Si el precio original es x, entonces el precio con descuento es 0.8x (ya que el 20% de descuento es el mismo que multiplicar por 0.8). Sabemos que este precio con descuento es lo que pagamos por 18 unidades, así que:

18 (0.8x) = 500

Simplificando esta ecuación:

14.4x = 500

x = 34.72 (redondeado a dos decimales)

Por lo tanto, el precio original por unidad fue de $ 34.72.
 34.72 
 Tutor: ¿Puedes hablarme sobre tu solución? 
 Tutor: Hola estudiante, ¿puedes hablarme sobre tu solución? 
 Estudiante: ¡Claro! Comencé encontrando el precio por unidad después del 20% de descuento. Sabía que el precio original era x, así que lo multiplicé por 0.8 para obtener el precio con descuento. Entonces supe que este precio con descuento era lo que pagamos por 18 unidades, así que configuré una ecuación con 18 multiplicada por 0.8x igual a 500. Después de simplificar la ecuación, obtuve x = 34.72, que es el precio original por unidad. 
 Tutor: Ok, comencemos con el primer paso. ¿Cuánto es el 80% del costo total? 
 Estudiante: el 80% del costo total es de 0.8x. Entonces, si el precio original es x, el precio con descuento es 0.8x. 
 Tutor: centrémonos en la cantidad total en lugar de la cantidad de la unidad 
 Estudiante: Claro. Sabemos que el monto total pagado por 18 unidades fue de $ 500. Entonces configuré una ecuación con 18 multiplicadas por 0.8x igual a 500. Después de simplificar la ecuación, obtuve x = 34.72, que es el precio original de la cantidad total."
6,145-232cdfd3-a855-443f-acd3-fc189811e0b4,"Tutor: Hi, could you please provide a step-by-step solution for the question below? The question is: John plans to sell all his toys and use the money to buy video games. He has 13 lego sets and he sells them for $15 each. He ends up buying 8 video games for $20 each and has $5 left. How many lego sets does he still have? 
 Student: John earned 13 x $15 = $195 from selling his lego sets.
He spent 8 x $20 = $160 on video games.
He had $5 left, so he had $195 - $160 - $5 = $30 left after buying the video games.
Since he sold each lego set for $15, he must have sold $30/$15 = 2 lego sets.
Therefore, he still has 13 - 2 = 11 lego sets. 
 11 
 Tutor: which gave me $195. Then I calculated how much money he spent on video games which was 8 sets at $20 each for a total of $160. I then subtracted the $160 he spent on video games from the $195 he earned from selling the lego sets which gave me $35. I then divided that by $15 which told me how many lego sets he sold which was 2. Finally I subtracted 2 from 13 to get 11 which is how many lego sets he still has. 
 Tutor: Okay that seems like a lot of lego sets. How much money did he have left after buying video games? 
 Student: He had $195 - $160 - $5 = $30 left after buying the video games. 
 Tutor: Super well done. So he has $30 left and how much did lego sets cost? 
 Student: Each lego set cost $15. 
 Tutor: Super so what's $30 divided by $15? 
 Student: $30 divided by $15 is 2 so he sold 2 lego sets. 
 Tutor: It is 2 but remember that's the money left over... 
 Student: Oh right. So he sold 2 lego sets and still has 11 left. 
 Tutor: Not quite try swapping it around 
 Student: Oh I see. He still has 11 lego sets and sold 2.","Tutor: Hola, ¿podría proporcionar una solución paso a paso para la pregunta a continuación? La pregunta es: John planea vender todos sus juguetes y usar el dinero para comprar videojuegos. Tiene 13 sets LEGO y los vende por $ 15 cada uno. Termina comprando 8 videojuegos por $ 20 cada uno y le quedan $ 5. ¿Cuántos conjuntos de LEGO todavía tiene? 
 Estudiante: John obtuvo 13 x $ 15 = $ 195 al vender sus sets de Lego.
Gastó 8 x $ 20 = $ 160 en videojuegos.
Le quedaban $ 5, por lo que tenía $ 195 - $ 160 - $ 5 = $ 30 restantes después de comprar los videojuegos.
Como vendió cada set de Lego por $ 15, debe haber vendido $ 30/$ 15 = 2 conjuntos LEGO.
Por lo tanto, todavía tiene 13 - 2 = 11 conjuntos LEGO. 
 11 
 Tutor: que me dio $ 195. Luego calculé cuánto dinero gastó en videojuegos, que eran 8 sets a $ 20 cada uno por un total de $ 160. Luego resté los $ 160 que gastó en videojuegos de los $ 195 que ganó al vender los sets LEGO que me dieron $ 35. Luego dividí eso por $ 15 que me dijo cuántos conjuntos de Lego vendió, que era 2. Finalmente resté 2 de 13 para obtener 11, que es cuántos conjuntos de Lego todavía tiene. 
 Tutor: Bien, eso parece muchos sets de LEGO. ¿Cuánto dinero le quedó después de comprar videojuegos? 
 Estudiante: tenía $ 195 - $ 160 - $ 5 = $ 30 restantes después de comprar los videojuegos. 
 Tutor: Super bien hecho. Entonces le quedan $ 30 y ¿cuánto costaron los conjuntos de Lego? 
 Estudiante: cada conjunto de LEGO cuesta $ 15. 
 Tutor: Super Entonces, ¿qué es $ 30 dividido por $ 15? 
 Estudiante: $ 30 dividido por $ 15 es 2, por lo que vendió 2 sets LEGO. 
 Tutor: son 2 pero recuerda que ese es el dinero que queda ... 
 Estudiante: Oh, claro. Entonces vendió 2 sets de Lego y todavía le quedan 11. 
 Tutor: No intente cambiarlo 
 Estudiante: Oh, ya veo. Todavía tiene 11 sets LEGO y vendió 2."
7,3660-a26cf722-9f4c-4e4d-b38b-bbb00c5172e2,"Tutor: Hi, could you please provide a step-by-step solution for the question below? The question is: The dog toys Samantha buys for her dog are ""buy one get one half off"" and all cost $12.00 each. She buys 4 toys.  How much does she spend on dog toys? 
 Student: Samantha buys 4 toys at $12.00 each.
For each pair of toys, she gets one at full price and one at half price.
So she pays for three full price toys and one half price toy.
Three full price toys cost 3 x $12.00 = $36.00.
One half price toy costs $12.00 / 2 = $6.00.
Therefore, Samantha spends $36.00 + $6.00 = $42.00 on dog toys.
 42.00 
 Tutor: I added the two amounts together to get a total of $36.00 + $6.00 = $42.00.","Tutor: Hola, ¿podría proporcionar una solución paso a paso para la pregunta a continuación? La pregunta es: los juguetes para perros que Samantha compra para su perro son ""Compre uno para obtener una mitad de descuento"" y todos cuestan $ 12.00 cada uno. Ella compra 4 juguetes.  ¿Cuánto gasta ella en juguetes para perros? 
 Estudiante: Samantha compra 4 juguetes a $ 12.00 cada uno.
Para cada par de juguetes, obtiene uno a precio completo y uno a mitad de precio.
Entonces paga por tres juguetes de precio completo y un juguete de medio precio.
Tres juguetes de precio completo cuestan 3 x $ 12.00 = $ 36.00.
El juguete de medio precio cuesta $ 12.00 / 2 = $ 6.00.
Por lo tanto, Samantha gasta $ 36.00 + $ 6.00 = $ 42.00 en juguetes para perros.
 42.00 
 Tutor: Agregué las dos cantidades juntas para obtener un total de $ 36.00 + $ 6.00 = $ 42.00."
8,429629538_1,"Tutor: We need to subtract total windows from the windows washed by lucy and Kevin. 
 Tutor: We need to subtract 24 from 15. 
 Tutor: What is the value of 24-15?
 Student: 11","Tutor: Necesitamos restar ventanas totales de las ventanas lavadas por Lucy y Kevin. 
 Tutor: Necesitamos restar 24 de 15. 
 Tutor: ¿Cuál es el valor de 24-15?
 Estudiante: 11"
